object_id,title,content,datetime_created,datetime_updated,tags,categories
524,,"Morbi non lectus. Aliquam sit amet diam in magna bibendum imperdiet. Nullam orci pede, venenatis non, sodales sed, tincidunt eu, felis.

Fusce posuere felis sed lacus. Morbi sem mauris, laoreet ut, rhoncus aliquet, pulvinar sed, nisl. Nunc rhoncus dui vel sem.

Sed sagittis. Nam congue, risus semper porta volutpat, quam pede lobortis ligula, sit amet eleifend pede libero quis orci. Nullam molestie nibh in lectus.

Pellentesque at nulla. Suspendisse potenti. Cras in purus eu magna vulputate luctus.",2018-06-25T17:32:57Z,,"[{""tag"":""panda""},{""tag"":""ape""}]",
525,placerat praesent blandit nam nulla integer pede justo lacinia,"Cras non velit nec nisi vulputate nonummy. Maecenas tincidunt lacus at velit. Vivamus vel nulla eget eros elementum pellentesque.

Quisque porta volutpat erat. Quisque erat eros, viverra eget, congue eget, semper rutrum, nulla. Nunc purus.

Phasellus in felis. Donec semper sapien a libero. Nam dui.",2019-07-02T20:12:26Z,2019-05-14T05:42:37Z,,"[{""category"":""orange-type-color""},{""category"":""purple""},{""category"":""orange-type-color""}]"
526,vel ipsum praesent blandit lacinia erat vestibulum sed magna at nunc commodo placerat,"Fusce posuere felis sed lacus. Morbi sem mauris, laoreet ut, rhoncus aliquet, pulvinar sed, nisl. Nunc rhoncus dui vel sem.

Sed sagittis. Nam congue, risus semper porta volutpat, quam pede lobortis ligula, sit amet eleifend pede libero quis orci. Nullam molestie nibh in lectus.

Pellentesque at nulla. Suspendisse potenti. Cras in purus eu magna vulputate luctus.

Cum sociis natoque penatibus et magnis dis parturient montes, nascetur ridiculus mus. Vivamus vestibulum sagittis sapien. Cum sociis natoque penatibus et magnis dis parturient montes, nascetur ridiculus mus.",2019-01-26T21:47:48Z,2019-08-14T02:22:30Z,"[{""tag"":""eagle""},{""tag"":""eagle""},{""tag"":""BEAR""}]","[{""category"":""gold""},{""category"":""grey1""},{""category"":""gold""}]"
527,nulla tellus,"Maecenas tristique, est et tempus semper, est quam pharetra magna, ac consequat metus sapien ut nunc. Vestibulum ante ipsum primis in faucibus orci luctus et ultrices posuere cubilia Curae; Mauris viverra diam vitae quam. Suspendisse potenti.

Nullam porttitor lacus at turpis. Donec posuere metus vitae ipsum. Aliquam non mauris.",2017-11-17T15:55:53Z,2018-07-08T17:53:40Z,"[{""tag"":""eagle""},{""tag"":""panda""},{""tag"":""K1ola""},{""tag"":""eagle""}]","[{""category"":""orange-type-color""},{""category"":""orange-type-color""}]"
528,cursus urna ut tellus nulla ut erat id mauris vulputate elementum nullam,Sed ante. Vivamus tortor. Duis mattis egestas metus.,2019-10-29T18:17:48Z,2019-12-11T00:38:37Z,"[{""tag"":""panda""}]",
529,varius nulla facilisi cras non velit nec nisi vulputate nonummy,"Integer tincidunt ante vel ipsum. Praesent blandit lacinia erat. Vestibulum sed magna at nunc commodo placerat.

Praesent blandit. Nam nulla. Integer pede justo, lacinia eget, tincidunt eget, tempus vel, pede.",2019-11-22T00:15:35Z,2018-01-19T18:07:55Z,,"[{""category"":""grey1""},{""category"":""gold""},{""category"":""gold""},{""category"":""Brown""}]"
530,id ligula suspendisse ornare consequat lectus in est risus auctor sed tristique in tempus sit,"Proin eu mi. Nulla ac enim. In tempor, turpis nec euismod scelerisque, quam turpis adipiscing lorem, vitae mattis nibh ligula nec sem.

Duis aliquam convallis nunc. Proin at turpis a pede posuere nonummy. Integer non velit.

Donec diam neque, vestibulum eget, vulputate ut, ultrices vel, augue. Vestibulum ante ipsum primis in faucibus orci luctus et ultrices posuere cubilia Curae; Donec pharetra, magna vestibulum aliquet ultrices, erat tortor sollicitudin mi, sit amet lobortis sapien sapien non mi. Integer ac neque.

Duis bibendum. Morbi non quam nec dui luctus rutrum. Nulla tellus.

In sagittis dui vel nisl. Duis ac nibh. Fusce lacus purus, aliquet at, feugiat non, pretium quis, lectus.",2017-04-16T20:53:57Z,,"[{""tag"":""lion""},{""tag"":""lion""},{""tag"":""panda""}]","[{""category"":""blue""}]"
531,,"Quisque id justo sit amet sapien dignissim vestibulum. Vestibulum ante ipsum primis in faucibus orci luctus et ultrices posuere cubilia Curae; Nulla dapibus dolor vel est. Donec odio justo, sollicitudin ut, suscipit a, feugiat et, eros.

Vestibulum ac est lacinia nisi venenatis tristique. Fusce congue, diam id ornare imperdiet, sapien urna pretium nisl, ut volutpat sapien arcu sed augue. Aliquam erat volutpat.

In congue. Etiam justo. Etiam pretium iaculis justo.",2017-01-09T06:45:54Z,2018-12-02T00:23:52Z,,"[{""category"":""blue""},{""category"":""Brown""},{""category"":""Brown""}]"
532,id nulla ultrices aliquet maecenas leo odio condimentum id luctus nec molestie sed justo pellentesque,"Fusce consequat. Nulla nisl. Nunc nisl.

Duis bibendum, felis sed interdum venenatis, turpis enim blandit mi, in porttitor pede justo eu massa. Donec dapibus. Duis at velit eu est congue elementum.",2018-08-26T09:18:08Z,2018-01-21T22:22:02Z,"[{""tag"":""polar bear""},{""tag"":""lion""},{""tag"":""eagle""}]","[{""category"":""BLACK""},{""category"":""grey1""},{""category"":""purple""},{""category"":""gold""}]"
533,,"Aliquam quis turpis eget elit sodales scelerisque. Mauris sit amet eros. Suspendisse accumsan tortor quis turpis.

Sed ante. Vivamus tortor. Duis mattis egestas metus.

Aenean fermentum. Donec ut mauris eget massa tempor convallis. Nulla neque libero, convallis eget, eleifend luctus, ultricies eu, nibh.",2016-11-02T23:22:50Z,,"[{""tag"":""lion""}]","[{""category"":""BLACK""},{""category"":""orange-type-color""}]"
534,libero non mattis pulvinar nulla pede ullamcorper augue a suscipit nulla elit ac nulla sed,"Sed sagittis. Nam congue, risus semper porta volutpat, quam pede lobortis ligula, sit amet eleifend pede libero quis orci. Nullam molestie nibh in lectus.

Pellentesque at nulla. Suspendisse potenti. Cras in purus eu magna vulputate luctus.",2018-10-30T09:52:41Z,,"[{""tag"":""panda""},{""tag"":""ape""}]","[{""category"":""BLACK""},{""category"":""grey1""},{""category"":""Brown""}]"
535,neque sapien placerat ante nulla justo aliquam quis turpis,"Vestibulum ac est lacinia nisi venenatis tristique. Fusce congue, diam id ornare imperdiet, sapien urna pretium nisl, ut volutpat sapien arcu sed augue. Aliquam erat volutpat.

In congue. Etiam justo. Etiam pretium iaculis justo.",2017-09-29T16:42:47Z,2018-03-07T13:37:53Z,"[{""tag"":""caT""},{""tag"":""polar bear""},{""tag"":""BEAR""},{""tag"":""BEAR""}]",
536,lobortis convallis tortor,"Maecenas leo odio, condimentum id, luctus nec, molestie sed, justo. Pellentesque viverra pede ac diam. Cras pellentesque volutpat dui.

Maecenas tristique, est et tempus semper, est quam pharetra magna, ac consequat metus sapien ut nunc. Vestibulum ante ipsum primis in faucibus orci luctus et ultrices posuere cubilia Curae; Mauris viverra diam vitae quam. Suspendisse potenti.

Nullam porttitor lacus at turpis. Donec posuere metus vitae ipsum. Aliquam non mauris.",2016-09-28T23:29:01Z,2016-08-02T11:06:31Z,"[{""tag"":""BEAR""},{""tag"":""panda""},{""tag"":""lion""},{""tag"":""K1ola""},{""tag"":""panda""},{""tag"":""penguin!""}]","[{""category"":""gold""},{""category"":""BLACK""}]"
537,dolor quis odio consequat varius,"Lorem ipsum dolor sit amet, consectetuer adipiscing elit. Proin risus. Praesent lectus.

Vestibulum quam sapien, varius ut, blandit non, interdum in, ante. Vestibulum ante ipsum primis in faucibus orci luctus et ultrices posuere cubilia Curae; Duis faucibus accumsan odio. Curabitur convallis.

Duis consequat dui nec nisi volutpat eleifend. Donec ut dolor. Morbi vel lectus in quam fringilla rhoncus.

Mauris enim leo, rhoncus sed, vestibulum sit amet, cursus id, turpis. Integer aliquet, massa id lobortis convallis, tortor risus dapibus augue, vel accumsan tellus nisi eu orci. Mauris lacinia sapien quis libero.",2019-10-23T07:02:36Z,2020-01-11T06:38:06Z,"[{""tag"":""eagle""},{""tag"":""K1ola""},{""tag"":""ape""}]","[{""category"":""grey1""},{""category"":""blue""},{""category"":""grey1""},{""category"":""Brown""},{""category"":""blue""}]"
538,pede justo lacinia eget tincidunt eget tempus vel pede morbi porttitor lorem,"Lorem ipsum dolor sit amet, consectetuer adipiscing elit. Proin risus. Praesent lectus.

Vestibulum quam sapien, varius ut, blandit non, interdum in, ante. Vestibulum ante ipsum primis in faucibus orci luctus et ultrices posuere cubilia Curae; Duis faucibus accumsan odio. Curabitur convallis.",2018-02-21T21:07:21Z,2016-04-29T18:18:29Z,,"[{""category"":""grey1""}]"
539,ante ipsum primis in faucibus orci luctus et ultrices posuere,"Vestibulum quam sapien, varius ut, blandit non, interdum in, ante. Vestibulum ante ipsum primis in faucibus orci luctus et ultrices posuere cubilia Curae; Duis faucibus accumsan odio. Curabitur convallis.

Duis consequat dui nec nisi volutpat eleifend. Donec ut dolor. Morbi vel lectus in quam fringilla rhoncus.

Mauris enim leo, rhoncus sed, vestibulum sit amet, cursus id, turpis. Integer aliquet, massa id lobortis convallis, tortor risus dapibus augue, vel accumsan tellus nisi eu orci. Mauris lacinia sapien quis libero.",2019-10-08T10:14:31Z,2018-12-19T13:02:13Z,,"[{""category"":""blue""},{""category"":""Brown""}]"
540,aliquam convallis nunc proin,"Proin eu mi. Nulla ac enim. In tempor, turpis nec euismod scelerisque, quam turpis adipiscing lorem, vitae mattis nibh ligula nec sem.

Duis aliquam convallis nunc. Proin at turpis a pede posuere nonummy. Integer non velit.

Donec diam neque, vestibulum eget, vulputate ut, ultrices vel, augue. Vestibulum ante ipsum primis in faucibus orci luctus et ultrices posuere cubilia Curae; Donec pharetra, magna vestibulum aliquet ultrices, erat tortor sollicitudin mi, sit amet lobortis sapien sapien non mi. Integer ac neque.

Duis bibendum. Morbi non quam nec dui luctus rutrum. Nulla tellus.

In sagittis dui vel nisl. Duis ac nibh. Fusce lacus purus, aliquet at, feugiat non, pretium quis, lectus.",2019-03-26T21:55:53Z,2019-09-05T10:02:23Z,"[{""tag"":""penguin!""}]","[{""category"":""blue""},{""category"":""Brown""},{""category"":""purple""},{""category"":""blue""}]"
541,ante ipsum primis in,"Proin interdum mauris non ligula pellentesque ultrices. Phasellus id sapien in sapien iaculis congue. Vivamus metus arcu, adipiscing molestie, hendrerit at, vulputate vitae, nisl.

Aenean lectus. Pellentesque eget nunc. Donec quis orci eget orci vehicula condimentum.

Curabitur in libero ut massa volutpat convallis. Morbi odio odio, elementum eu, interdum eu, tincidunt in, leo. Maecenas pulvinar lobortis est.

Phasellus sit amet erat. Nulla tempus. Vivamus in felis eu sapien cursus vestibulum.",2016-01-16T00:52:00Z,,"[{""tag"":""penguin!""},{""tag"":""ape""}]","[{""category"":""BLACK""},{""category"":""Brown""},{""category"":""blue""}]"
542,,"Praesent id massa id nisl venenatis lacinia. Aenean sit amet justo. Morbi ut odio.

Cras mi pede, malesuada in, imperdiet et, commodo vulputate, justo. In blandit ultrices enim. Lorem ipsum dolor sit amet, consectetuer adipiscing elit.

Proin interdum mauris non ligula pellentesque ultrices. Phasellus id sapien in sapien iaculis congue. Vivamus metus arcu, adipiscing molestie, hendrerit at, vulputate vitae, nisl.

Aenean lectus. Pellentesque eget nunc. Donec quis orci eget orci vehicula condimentum.",2017-07-05T05:31:34Z,2019-07-26T16:10:25Z,"[{""tag"":""caT""},{""tag"":""K1ola""},{""tag"":""lion""}]","[{""category"":""Brown""},{""category"":""grey1""},{""category"":""blue""}]"
543,curae nulla dapibus dolor vel est donec odio,"Integer tincidunt ante vel ipsum. Praesent blandit lacinia erat. Vestibulum sed magna at nunc commodo placerat.

Praesent blandit. Nam nulla. Integer pede justo, lacinia eget, tincidunt eget, tempus vel, pede.",2019-07-13T08:49:03Z,2019-06-29T23:53:14Z,"[{""tag"":""lion""},{""tag"":""polar-bear""}]","[{""category"":""blue""},{""category"":""blue""},{""category"":""grey1""},{""category"":""orange-type-color""},{""category"":""BLACK""}]"
544,volutpat sapien arcu sed augue aliquam erat volutpat in congue etiam justo,"Maecenas ut massa quis augue luctus tincidunt. Nulla mollis molestie lorem. Quisque ut erat.

Curabitur gravida nisi at nibh. In hac habitasse platea dictumst. Aliquam augue quam, sollicitudin vitae, consectetuer eget, rutrum at, lorem.

Integer tincidunt ante vel ipsum. Praesent blandit lacinia erat. Vestibulum sed magna at nunc commodo placerat.

Praesent blandit. Nam nulla. Integer pede justo, lacinia eget, tincidunt eget, tempus vel, pede.",2016-02-23T09:29:09Z,,"[{""tag"":""panda""},{""tag"":""penguin!""},{""tag"":""polar bear""},{""tag"":""lion""},{""tag"":""ape""},{""tag"":""polar-bear""}]",
545,diam vitae quam suspendisse potenti nullam porttitor lacus at turpis donec posuere metus vitae,"In hac habitasse platea dictumst. Morbi vestibulum, velit id pretium iaculis, diam erat fermentum justo, nec condimentum neque sapien placerat ante. Nulla justo.

Aliquam quis turpis eget elit sodales scelerisque. Mauris sit amet eros. Suspendisse accumsan tortor quis turpis.

Sed ante. Vivamus tortor. Duis mattis egestas metus.

Aenean fermentum. Donec ut mauris eget massa tempor convallis. Nulla neque libero, convallis eget, eleifend luctus, ultricies eu, nibh.",2019-03-30T07:57:24Z,,"[{""tag"":""K1ola""}]",
546,vitae nisi nam ultrices libero non mattis pulvinar nulla pede ullamcorper augue a suscipit nulla,"Suspendisse potenti. In eleifend quam a odio. In hac habitasse platea dictumst.

Maecenas ut massa quis augue luctus tincidunt. Nulla mollis molestie lorem. Quisque ut erat.

Curabitur gravida nisi at nibh. In hac habitasse platea dictumst. Aliquam augue quam, sollicitudin vitae, consectetuer eget, rutrum at, lorem.

Integer tincidunt ante vel ipsum. Praesent blandit lacinia erat. Vestibulum sed magna at nunc commodo placerat.

Praesent blandit. Nam nulla. Integer pede justo, lacinia eget, tincidunt eget, tempus vel, pede.",2018-10-19T05:55:25Z,2019-05-28T02:37:56Z,"[{""tag"":""BEAR""},{""tag"":""polar bear""},{""tag"":""polar-bear""}]","[{""category"":""BLACK""},{""category"":""BLACK""}]"
547,quam sapien varius ut blandit non interdum in ante,Duis bibendum. Morbi non quam nec dui luctus rutrum. Nulla tellus.,2019-03-26T02:37:44Z,2019-01-01T09:54:45Z,"[{""tag"":""BEAR""},{""tag"":""BEAR""},{""tag"":""eagle""},{""tag"":""panda""},{""tag"":""caT""},{""tag"":""BEAR""},{""tag"":""caT""}]","[{""category"":""BLACK""},{""category"":""blue""},{""category"":""purple""},{""category"":""BLACK""}]"
548,duis bibendum morbi non quam nec dui luctus rutrum nulla,"Quisque porta volutpat erat. Quisque erat eros, viverra eget, congue eget, semper rutrum, nulla. Nunc purus.

Phasellus in felis. Donec semper sapien a libero. Nam dui.

Proin leo odio, porttitor id, consequat in, consequat ut, nulla. Sed accumsan felis. Ut at dolor quis odio consequat varius.

Integer ac leo. Pellentesque ultrices mattis odio. Donec vitae nisi.

Nam ultrices, libero non mattis pulvinar, nulla pede ullamcorper augue, a suscipit nulla elit ac nulla. Sed vel enim sit amet nunc viverra dapibus. Nulla suscipit ligula in lacus.",2016-04-13T12:13:34Z,2019-11-12T08:51:08Z,"[{""tag"":""polar bear""},{""tag"":""K1ola""},{""tag"":""K1ola""},{""tag"":""panda""},{""tag"":""lion""},{""tag"":""lion""},{""tag"":""K1ola""}]",
549,in porttitor pede,"Duis aliquam convallis nunc. Proin at turpis a pede posuere nonummy. Integer non velit.

Donec diam neque, vestibulum eget, vulputate ut, ultrices vel, augue. Vestibulum ante ipsum primis in faucibus orci luctus et ultrices posuere cubilia Curae; Donec pharetra, magna vestibulum aliquet ultrices, erat tortor sollicitudin mi, sit amet lobortis sapien sapien non mi. Integer ac neque.

Duis bibendum. Morbi non quam nec dui luctus rutrum. Nulla tellus.",2019-02-17T20:37:28Z,2016-10-13T14:20:55Z,"[{""tag"":""penguin!""},{""tag"":""caT""},{""tag"":""lion""},{""tag"":""polar-bear""},{""tag"":""eagle""},{""tag"":""eagle""}]","[{""category"":""blue""},{""category"":""gold""}]"
550,sapien a libero nam dui proin leo odio porttitor,"Duis bibendum, felis sed interdum venenatis, turpis enim blandit mi, in porttitor pede justo eu massa. Donec dapibus. Duis at velit eu est congue elementum.

In hac habitasse platea dictumst. Morbi vestibulum, velit id pretium iaculis, diam erat fermentum justo, nec condimentum neque sapien placerat ante. Nulla justo.",2019-10-19T22:29:34Z,2018-11-29T23:01:48Z,"[{""tag"":""BEAR""},{""tag"":""penguin!""},{""tag"":""K1ola""},{""tag"":""panda""},{""tag"":""caT""}]","[{""category"":""gold""}]"
551,,"Curabitur in libero ut massa volutpat convallis. Morbi odio odio, elementum eu, interdum eu, tincidunt in, leo. Maecenas pulvinar lobortis est.

Phasellus sit amet erat. Nulla tempus. Vivamus in felis eu sapien cursus vestibulum.

Proin eu mi. Nulla ac enim. In tempor, turpis nec euismod scelerisque, quam turpis adipiscing lorem, vitae mattis nibh ligula nec sem.

Duis aliquam convallis nunc. Proin at turpis a pede posuere nonummy. Integer non velit.",2016-06-16T07:37:53Z,2019-07-25T22:32:19Z,,"[{""category"":""purple""},{""category"":""grey1""},{""category"":""purple""},{""category"":""BLACK""}]"
552,diam erat fermentum justo,"Sed sagittis. Nam congue, risus semper porta volutpat, quam pede lobortis ligula, sit amet eleifend pede libero quis orci. Nullam molestie nibh in lectus.

Pellentesque at nulla. Suspendisse potenti. Cras in purus eu magna vulputate luctus.

Cum sociis natoque penatibus et magnis dis parturient montes, nascetur ridiculus mus. Vivamus vestibulum sagittis sapien. Cum sociis natoque penatibus et magnis dis parturient montes, nascetur ridiculus mus.

Etiam vel augue. Vestibulum rutrum rutrum neque. Aenean auctor gravida sem.",2018-08-28T19:28:33Z,2016-05-19T16:01:38Z,"[{""tag"":""lion""},{""tag"":""panda""},{""tag"":""BEAR""},{""tag"":""ape""},{""tag"":""eagle""},{""tag"":""BEAR""}]",
553,,"Aenean lectus. Pellentesque eget nunc. Donec quis orci eget orci vehicula condimentum.

Curabitur in libero ut massa volutpat convallis. Morbi odio odio, elementum eu, interdum eu, tincidunt in, leo. Maecenas pulvinar lobortis est.

Phasellus sit amet erat. Nulla tempus. Vivamus in felis eu sapien cursus vestibulum.",2019-07-03T15:44:29Z,2018-03-13T10:45:08Z,"[{""tag"":""panda""},{""tag"":""BEAR""},{""tag"":""polar-bear""}]",
554,,"Donec diam neque, vestibulum eget, vulputate ut, ultrices vel, augue. Vestibulum ante ipsum primis in faucibus orci luctus et ultrices posuere cubilia Curae; Donec pharetra, magna vestibulum aliquet ultrices, erat tortor sollicitudin mi, sit amet lobortis sapien sapien non mi. Integer ac neque.",2016-05-03T21:57:01Z,2019-01-17T17:07:41Z,"[{""tag"":""polar-bear""},{""tag"":""polar bear""},{""tag"":""lion""}]","[{""category"":""gold""},{""category"":""purple""},{""category"":""blue""},{""category"":""gold""}]"
555,augue,"In sagittis dui vel nisl. Duis ac nibh. Fusce lacus purus, aliquet at, feugiat non, pretium quis, lectus.",2019-05-20T03:59:29Z,2019-07-02T17:10:57Z,"[{""tag"":""polar bear""},{""tag"":""penguin!""},{""tag"":""ape""},{""tag"":""caT""},{""tag"":""K1ola""},{""tag"":""caT""},{""tag"":""polar bear""}]","[{""category"":""grey1""},{""category"":""gold""}]"
556,ac nibh fusce,"Phasellus sit amet erat. Nulla tempus. Vivamus in felis eu sapien cursus vestibulum.

Proin eu mi. Nulla ac enim. In tempor, turpis nec euismod scelerisque, quam turpis adipiscing lorem, vitae mattis nibh ligula nec sem.

Duis aliquam convallis nunc. Proin at turpis a pede posuere nonummy. Integer non velit.

Donec diam neque, vestibulum eget, vulputate ut, ultrices vel, augue. Vestibulum ante ipsum primis in faucibus orci luctus et ultrices posuere cubilia Curae; Donec pharetra, magna vestibulum aliquet ultrices, erat tortor sollicitudin mi, sit amet lobortis sapien sapien non mi. Integer ac neque.",2018-02-14T03:48:27Z,2018-11-14T16:10:19Z,"[{""tag"":""polar-bear""},{""tag"":""polar bear""},{""tag"":""K1ola""},{""tag"":""ape""}]","[{""category"":""Brown""},{""category"":""grey1""}]"
557,pellentesque ultrices mattis odio donec vitae nisi nam ultrices libero non mattis pulvinar nulla pede,"Morbi non lectus. Aliquam sit amet diam in magna bibendum imperdiet. Nullam orci pede, venenatis non, sodales sed, tincidunt eu, felis.

Fusce posuere felis sed lacus. Morbi sem mauris, laoreet ut, rhoncus aliquet, pulvinar sed, nisl. Nunc rhoncus dui vel sem.",2019-12-13T21:32:51Z,2018-02-23T03:12:11Z,"[{""tag"":""penguin!""},{""tag"":""K1ola""},{""tag"":""eagle""},{""tag"":""penguin!""},{""tag"":""caT""},{""tag"":""BEAR""}]","[{""category"":""grey1""},{""category"":""purple""}]"
558,,"Maecenas leo odio, condimentum id, luctus nec, molestie sed, justo. Pellentesque viverra pede ac diam. Cras pellentesque volutpat dui.",2017-12-30T04:39:29Z,,,
559,pretium iaculis justo in,"Cum sociis natoque penatibus et magnis dis parturient montes, nascetur ridiculus mus. Vivamus vestibulum sagittis sapien. Cum sociis natoque penatibus et magnis dis parturient montes, nascetur ridiculus mus.

Etiam vel augue. Vestibulum rutrum rutrum neque. Aenean auctor gravida sem.",2019-02-23T13:44:05Z,,"[{""tag"":""polar-bear""},{""tag"":""BEAR""},{""tag"":""BEAR""},{""tag"":""eagle""}]","[{""category"":""orange-type-color""},{""category"":""gold""}]"
560,lectus pellentesque eget nunc donec quis orci eget orci vehicula condimentum curabitur in libero ut,"Aenean lectus. Pellentesque eget nunc. Donec quis orci eget orci vehicula condimentum.

Curabitur in libero ut massa volutpat convallis. Morbi odio odio, elementum eu, interdum eu, tincidunt in, leo. Maecenas pulvinar lobortis est.

Phasellus sit amet erat. Nulla tempus. Vivamus in felis eu sapien cursus vestibulum.",2017-10-07T10:55:25Z,2018-08-16T23:03:03Z,"[{""tag"":""polar bear""}]","[{""category"":""gold""},{""category"":""BLACK""},{""category"":""orange-type-color""},{""category"":""BLACK""}]"
561,consequat morbi a ipsum integer a nibh in quis justo,"In hac habitasse platea dictumst. Etiam faucibus cursus urna. Ut tellus.

Nulla ut erat id mauris vulputate elementum. Nullam varius. Nulla facilisi.

Cras non velit nec nisi vulputate nonummy. Maecenas tincidunt lacus at velit. Vivamus vel nulla eget eros elementum pellentesque.

Quisque porta volutpat erat. Quisque erat eros, viverra eget, congue eget, semper rutrum, nulla. Nunc purus.",2019-12-05T10:05:49Z,,"[{""tag"":""penguin!""},{""tag"":""panda""}]","[{""category"":""gold""}]"
562,sed magna at nunc commodo placerat praesent blandit nam nulla integer pede,"Vestibulum quam sapien, varius ut, blandit non, interdum in, ante. Vestibulum ante ipsum primis in faucibus orci luctus et ultrices posuere cubilia Curae; Duis faucibus accumsan odio. Curabitur convallis.",2019-06-07T08:37:14Z,2018-09-11T01:57:42Z,,"[{""category"":""Brown""},{""category"":""purple""},{""category"":""purple""},{""category"":""BLACK""},{""category"":""BLACK""}]"
563,ullamcorper purus sit amet nulla,"Quisque id justo sit amet sapien dignissim vestibulum. Vestibulum ante ipsum primis in faucibus orci luctus et ultrices posuere cubilia Curae; Nulla dapibus dolor vel est. Donec odio justo, sollicitudin ut, suscipit a, feugiat et, eros.

Vestibulum ac est lacinia nisi venenatis tristique. Fusce congue, diam id ornare imperdiet, sapien urna pretium nisl, ut volutpat sapien arcu sed augue. Aliquam erat volutpat.

In congue. Etiam justo. Etiam pretium iaculis justo.

In hac habitasse platea dictumst. Etiam faucibus cursus urna. Ut tellus.

Nulla ut erat id mauris vulputate elementum. Nullam varius. Nulla facilisi.",2016-12-02T05:32:05Z,2019-12-03T08:18:04Z,"[{""tag"":""BEAR""},{""tag"":""lion""},{""tag"":""panda""},{""tag"":""eagle""},{""tag"":""polar bear""},{""tag"":""polar bear""},{""tag"":""panda""},{""tag"":""K1ola""}]",
564,sagittis nam congue risus semper porta volutpat quam pede,"Proin leo odio, porttitor id, consequat in, consequat ut, nulla. Sed accumsan felis. Ut at dolor quis odio consequat varius.

Integer ac leo. Pellentesque ultrices mattis odio. Donec vitae nisi.

Nam ultrices, libero non mattis pulvinar, nulla pede ullamcorper augue, a suscipit nulla elit ac nulla. Sed vel enim sit amet nunc viverra dapibus. Nulla suscipit ligula in lacus.",2016-11-11T02:14:30Z,2018-07-16T04:38:37Z,"[{""tag"":""panda""},{""tag"":""ape""},{""tag"":""lion""},{""tag"":""K1ola""},{""tag"":""K1ola""},{""tag"":""eagle""}]","[{""category"":""orange-type-color""},{""category"":""orange-type-color""}]"
565,maecenas pulvinar lobortis est phasellus,"Aenean fermentum. Donec ut mauris eget massa tempor convallis. Nulla neque libero, convallis eget, eleifend luctus, ultricies eu, nibh.

Quisque id justo sit amet sapien dignissim vestibulum. Vestibulum ante ipsum primis in faucibus orci luctus et ultrices posuere cubilia Curae; Nulla dapibus dolor vel est. Donec odio justo, sollicitudin ut, suscipit a, feugiat et, eros.

Vestibulum ac est lacinia nisi venenatis tristique. Fusce congue, diam id ornare imperdiet, sapien urna pretium nisl, ut volutpat sapien arcu sed augue. Aliquam erat volutpat.

In congue. Etiam justo. Etiam pretium iaculis justo.",2017-08-05T19:46:11Z,2017-05-09T20:14:24Z,"[{""tag"":""BEAR""}]","[{""category"":""purple""},{""category"":""grey1""},{""category"":""orange-type-color""}]"
566,,"In hac habitasse platea dictumst. Morbi vestibulum, velit id pretium iaculis, diam erat fermentum justo, nec condimentum neque sapien placerat ante. Nulla justo.

Aliquam quis turpis eget elit sodales scelerisque. Mauris sit amet eros. Suspendisse accumsan tortor quis turpis.

Sed ante. Vivamus tortor. Duis mattis egestas metus.",2018-11-27T00:57:35Z,,"[{""tag"":""BEAR""},{""tag"":""K1ola""},{""tag"":""caT""},{""tag"":""panda""},{""tag"":""polar-bear""},{""tag"":""lion""}]","[{""category"":""gold""},{""category"":""Brown""}]"
