object_id,title,content,datetime_created,datetime_updated,tags,categories
1,vehicula condimentum curabitur in libero ut massa volutpat convallis morbi odio odio elementum,"Proin eu mi. Nulla ac enim. In tempor, turpis nec euismod scelerisque, quam turpis adipiscing lorem, vitae mattis nibh ligula nec sem.

Duis aliquam convallis nunc. Proin at turpis a pede posuere nonummy. Integer non velit.

Donec diam neque, vestibulum eget, vulputate ut, ultrices vel, augue. Vestibulum ante ipsum primis in faucibus orci luctus et ultrices posuere cubilia Curae; Donec pharetra, magna vestibulum aliquet ultrices, erat tortor sollicitudin mi, sit amet lobortis sapien sapien non mi. Integer ac neque.

Duis bibendum. Morbi non quam nec dui luctus rutrum. Nulla tellus.",2019-02-28T19:52:02Z,2017-02-19T23:06:40Z,"[{""tag"":""BEAR""},{""tag"":""penguin!""},{""tag"":""ape""},{""tag"":""polar bear""},{""tag"":""penguin!""},{""tag"":""lion""}]","[{""category"":""purple""},{""category"":""orange-type-color""},{""category"":""BLACK""},{""category"":""gold""},{""category"":""grey1""}]"
2,,"Duis bibendum. Morbi non quam nec dui luctus rutrum. Nulla tellus.

In sagittis dui vel nisl. Duis ac nibh. Fusce lacus purus, aliquet at, feugiat non, pretium quis, lectus.

Suspendisse potenti. In eleifend quam a odio. In hac habitasse platea dictumst.

Maecenas ut massa quis augue luctus tincidunt. Nulla mollis molestie lorem. Quisque ut erat.

Curabitur gravida nisi at nibh. In hac habitasse platea dictumst. Aliquam augue quam, sollicitudin vitae, consectetuer eget, rutrum at, lorem.",2016-01-23T23:09:19Z,2019-10-27T23:35:54Z,"[{""tag"":""eagle""},{""tag"":""panda""}]","[{""category"":""BLACK""},{""category"":""grey1""}]"
3,posuere nonummy integer non,"Suspendisse potenti. In eleifend quam a odio. In hac habitasse platea dictumst.

Maecenas ut massa quis augue luctus tincidunt. Nulla mollis molestie lorem. Quisque ut erat.",2016-08-11T03:07:01Z,,"[{""tag"":""ape""},{""tag"":""polar bear""},{""tag"":""panda""},{""tag"":""panda""},{""tag"":""caT""}]","[{""category"":""purple""},{""category"":""orange-type-color""},{""category"":""gold""},{""category"":""grey1""}]"
4,in consequat ut nulla sed accumsan felis ut at dolor quis odio consequat varius,"Fusce consequat. Nulla nisl. Nunc nisl.

Duis bibendum, felis sed interdum venenatis, turpis enim blandit mi, in porttitor pede justo eu massa. Donec dapibus. Duis at velit eu est congue elementum.

In hac habitasse platea dictumst. Morbi vestibulum, velit id pretium iaculis, diam erat fermentum justo, nec condimentum neque sapien placerat ante. Nulla justo.

Aliquam quis turpis eget elit sodales scelerisque. Mauris sit amet eros. Suspendisse accumsan tortor quis turpis.",2017-08-14T04:54:15Z,2018-08-05T05:53:14Z,"[{""tag"":""BEAR""},{""tag"":""polar bear""},{""tag"":""K1ola""},{""tag"":""BEAR""},{""tag"":""BEAR""}]","[{""category"":""BLACK""},{""category"":""blue""},{""category"":""Brown""},{""category"":""BLACK""},{""category"":""gold""}]"
5,sed lacus morbi sem mauris laoreet ut rhoncus aliquet pulvinar sed nisl nunc rhoncus dui,"Aliquam quis turpis eget elit sodales scelerisque. Mauris sit amet eros. Suspendisse accumsan tortor quis turpis.

Sed ante. Vivamus tortor. Duis mattis egestas metus.

Aenean fermentum. Donec ut mauris eget massa tempor convallis. Nulla neque libero, convallis eget, eleifend luctus, ultricies eu, nibh.",2017-09-28T03:39:32Z,2016-04-28T11:07:00Z,"[{""tag"":""K1ola""},{""tag"":""eagle""},{""tag"":""caT""},{""tag"":""polar-bear""},{""tag"":""eagle""},{""tag"":""polar bear""}]","[{""category"":""BLACK""},{""category"":""gold""}]"
6,nulla sed accumsan felis ut at dolor quis odio consequat varius integer ac leo pellentesque,"Aenean lectus. Pellentesque eget nunc. Donec quis orci eget orci vehicula condimentum.

Curabitur in libero ut massa volutpat convallis. Morbi odio odio, elementum eu, interdum eu, tincidunt in, leo. Maecenas pulvinar lobortis est.

Phasellus sit amet erat. Nulla tempus. Vivamus in felis eu sapien cursus vestibulum.",2016-07-17T14:25:14Z,,"[{""tag"":""ape""},{""tag"":""K1ola""}]",
7,maecenas ut massa quis augue luctus,"Maecenas ut massa quis augue luctus tincidunt. Nulla mollis molestie lorem. Quisque ut erat.

Curabitur gravida nisi at nibh. In hac habitasse platea dictumst. Aliquam augue quam, sollicitudin vitae, consectetuer eget, rutrum at, lorem.

Integer tincidunt ante vel ipsum. Praesent blandit lacinia erat. Vestibulum sed magna at nunc commodo placerat.",2016-08-21T13:45:53Z,,"[{""tag"":""BEAR""},{""tag"":""ape""},{""tag"":""caT""}]","[{""category"":""grey1""},{""category"":""purple""},{""category"":""orange-type-color""}]"
8,auctor gravida sem,"Proin leo odio, porttitor id, consequat in, consequat ut, nulla. Sed accumsan felis. Ut at dolor quis odio consequat varius.

Integer ac leo. Pellentesque ultrices mattis odio. Donec vitae nisi.

Nam ultrices, libero non mattis pulvinar, nulla pede ullamcorper augue, a suscipit nulla elit ac nulla. Sed vel enim sit amet nunc viverra dapibus. Nulla suscipit ligula in lacus.",2020-01-02T06:34:13Z,2019-08-13T22:29:21Z,"[{""tag"":""polar bear""},{""tag"":""lion""},{""tag"":""lion""},{""tag"":""BEAR""},{""tag"":""ape""},{""tag"":""ape""}]","[{""category"":""BLACK""},{""category"":""orange-type-color""},{""category"":""blue""},{""category"":""purple""}]"
9,tellus,"Mauris enim leo, rhoncus sed, vestibulum sit amet, cursus id, turpis. Integer aliquet, massa id lobortis convallis, tortor risus dapibus augue, vel accumsan tellus nisi eu orci. Mauris lacinia sapien quis libero.

Nullam sit amet turpis elementum ligula vehicula consequat. Morbi a ipsum. Integer a nibh.",2017-04-19T17:52:23Z,2018-05-20T03:34:44Z,"[{""tag"":""BEAR""},{""tag"":""K1ola""},{""tag"":""polar bear""},{""tag"":""panda""},{""tag"":""polar-bear""},{""tag"":""K1ola""},{""tag"":""panda""},{""tag"":""penguin!""}]","[{""category"":""gold""},{""category"":""purple""},{""category"":""Brown""},{""category"":""Brown""}]"
10,nunc,"Maecenas tristique, est et tempus semper, est quam pharetra magna, ac consequat metus sapien ut nunc. Vestibulum ante ipsum primis in faucibus orci luctus et ultrices posuere cubilia Curae; Mauris viverra diam vitae quam. Suspendisse potenti.

Nullam porttitor lacus at turpis. Donec posuere metus vitae ipsum. Aliquam non mauris.

Morbi non lectus. Aliquam sit amet diam in magna bibendum imperdiet. Nullam orci pede, venenatis non, sodales sed, tincidunt eu, felis.",2018-03-18T19:11:15Z,2016-10-02T20:30:02Z,"[{""tag"":""polar bear""},{""tag"":""polar-bear""},{""tag"":""BEAR""},{""tag"":""eagle""},{""tag"":""penguin!""},{""tag"":""K1ola""},{""tag"":""polar bear""}]","[{""category"":""blue""}]"
11,montes nascetur ridiculus mus etiam vel augue,Phasellus in felis. Donec semper sapien a libero. Nam dui.,2017-12-21T13:31:27Z,2018-02-26T18:53:07Z,,"[{""category"":""grey1""}]"
12,ante vivamus tortor duis mattis egestas metus aenean fermentum donec,"Proin eu mi. Nulla ac enim. In tempor, turpis nec euismod scelerisque, quam turpis adipiscing lorem, vitae mattis nibh ligula nec sem.",2018-09-13T02:51:50Z,,"[{""tag"":""ape""}]","[{""category"":""orange-type-color""}]"
13,sapien cum sociis natoque penatibus et magnis dis parturient,"Duis bibendum. Morbi non quam nec dui luctus rutrum. Nulla tellus.

In sagittis dui vel nisl. Duis ac nibh. Fusce lacus purus, aliquet at, feugiat non, pretium quis, lectus.

Suspendisse potenti. In eleifend quam a odio. In hac habitasse platea dictumst.

Maecenas ut massa quis augue luctus tincidunt. Nulla mollis molestie lorem. Quisque ut erat.

Curabitur gravida nisi at nibh. In hac habitasse platea dictumst. Aliquam augue quam, sollicitudin vitae, consectetuer eget, rutrum at, lorem.",2017-04-24T05:22:01Z,,"[{""tag"":""K1ola""},{""tag"":""panda""},{""tag"":""BEAR""},{""tag"":""polar-bear""},{""tag"":""K1ola""},{""tag"":""caT""},{""tag"":""BEAR""}]","[{""category"":""grey1""},{""category"":""BLACK""},{""category"":""grey1""},{""category"":""purple""},{""category"":""grey1""}]"
14,,"Lorem ipsum dolor sit amet, consectetuer adipiscing elit. Proin risus. Praesent lectus.

Vestibulum quam sapien, varius ut, blandit non, interdum in, ante. Vestibulum ante ipsum primis in faucibus orci luctus et ultrices posuere cubilia Curae; Duis faucibus accumsan odio. Curabitur convallis.

Duis consequat dui nec nisi volutpat eleifend. Donec ut dolor. Morbi vel lectus in quam fringilla rhoncus.

Mauris enim leo, rhoncus sed, vestibulum sit amet, cursus id, turpis. Integer aliquet, massa id lobortis convallis, tortor risus dapibus augue, vel accumsan tellus nisi eu orci. Mauris lacinia sapien quis libero.

Nullam sit amet turpis elementum ligula vehicula consequat. Morbi a ipsum. Integer a nibh.",2019-03-27T06:21:27Z,2019-02-04T05:29:44Z,"[{""tag"":""polar-bear""},{""tag"":""polar bear""},{""tag"":""penguin!""},{""tag"":""K1ola""},{""tag"":""BEAR""},{""tag"":""panda""},{""tag"":""eagle""},{""tag"":""penguin!""}]",
15,enim lorem ipsum dolor sit,"In congue. Etiam justo. Etiam pretium iaculis justo.

In hac habitasse platea dictumst. Etiam faucibus cursus urna. Ut tellus.",2019-06-19T06:23:48Z,2018-06-12T02:58:12Z,"[{""tag"":""BEAR""},{""tag"":""panda""},{""tag"":""ape""},{""tag"":""polar bear""},{""tag"":""polar bear""},{""tag"":""BEAR""}]","[{""category"":""blue""}]"
16,massa,"Nullam sit amet turpis elementum ligula vehicula consequat. Morbi a ipsum. Integer a nibh.

In quis justo. Maecenas rhoncus aliquam lacus. Morbi quis tortor id nulla ultrices aliquet.",2019-10-06T17:31:18Z,,"[{""tag"":""lion""},{""tag"":""eagle""},{""tag"":""BEAR""}]",
17,morbi a ipsum integer a nibh,"Praesent id massa id nisl venenatis lacinia. Aenean sit amet justo. Morbi ut odio.

Cras mi pede, malesuada in, imperdiet et, commodo vulputate, justo. In blandit ultrices enim. Lorem ipsum dolor sit amet, consectetuer adipiscing elit.",2016-04-02T00:24:27Z,2016-08-26T04:56:43Z,"[{""tag"":""lion""},{""tag"":""eagle""},{""tag"":""BEAR""},{""tag"":""BEAR""},{""tag"":""K1ola""},{""tag"":""eagle""},{""tag"":""BEAR""}]","[{""category"":""orange-type-color""},{""category"":""blue""}]"
18,pellentesque eget nunc donec quis orci eget,"Praesent blandit. Nam nulla. Integer pede justo, lacinia eget, tincidunt eget, tempus vel, pede.

Morbi porttitor lorem id ligula. Suspendisse ornare consequat lectus. In est risus, auctor sed, tristique in, tempus sit amet, sem.",2017-04-15T13:31:22Z,,"[{""tag"":""eagle""},{""tag"":""polar bear""},{""tag"":""penguin!""},{""tag"":""K1ola""},{""tag"":""lion""}]","[{""category"":""gold""},{""category"":""gold""},{""category"":""BLACK""}]"
19,,"Nulla ut erat id mauris vulputate elementum. Nullam varius. Nulla facilisi.

Cras non velit nec nisi vulputate nonummy. Maecenas tincidunt lacus at velit. Vivamus vel nulla eget eros elementum pellentesque.

Quisque porta volutpat erat. Quisque erat eros, viverra eget, congue eget, semper rutrum, nulla. Nunc purus.

Phasellus in felis. Donec semper sapien a libero. Nam dui.

Proin leo odio, porttitor id, consequat in, consequat ut, nulla. Sed accumsan felis. Ut at dolor quis odio consequat varius.",2018-07-04T15:33:18Z,,"[{""tag"":""lion""},{""tag"":""K1ola""},{""tag"":""caT""},{""tag"":""K1ola""},{""tag"":""penguin!""}]","[{""category"":""orange-type-color""},{""category"":""blue""},{""category"":""blue""},{""category"":""purple""},{""category"":""BLACK""}]"
20,dolor quis odio consequat varius integer ac leo pellentesque ultrices mattis odio,"Mauris enim leo, rhoncus sed, vestibulum sit amet, cursus id, turpis. Integer aliquet, massa id lobortis convallis, tortor risus dapibus augue, vel accumsan tellus nisi eu orci. Mauris lacinia sapien quis libero.

Nullam sit amet turpis elementum ligula vehicula consequat. Morbi a ipsum. Integer a nibh.

In quis justo. Maecenas rhoncus aliquam lacus. Morbi quis tortor id nulla ultrices aliquet.

Maecenas leo odio, condimentum id, luctus nec, molestie sed, justo. Pellentesque viverra pede ac diam. Cras pellentesque volutpat dui.",2018-09-11T20:18:51Z,,"[{""tag"":""caT""},{""tag"":""polar bear""}]","[{""category"":""grey1""},{""category"":""purple""}]"
21,adipiscing elit proin risus praesent lectus vestibulum quam sapien varius ut blandit non interdum,"Nullam porttitor lacus at turpis. Donec posuere metus vitae ipsum. Aliquam non mauris.

Morbi non lectus. Aliquam sit amet diam in magna bibendum imperdiet. Nullam orci pede, venenatis non, sodales sed, tincidunt eu, felis.",2018-02-20T01:10:43Z,,"[{""tag"":""BEAR""},{""tag"":""eagle""},{""tag"":""polar-bear""},{""tag"":""BEAR""},{""tag"":""caT""},{""tag"":""penguin!""}]","[{""category"":""orange-type-color""},{""category"":""grey1""},{""category"":""Brown""}]"
22,quis tortor id nulla ultrices aliquet maecenas leo odio condimentum id,"Morbi porttitor lorem id ligula. Suspendisse ornare consequat lectus. In est risus, auctor sed, tristique in, tempus sit amet, sem.

Fusce consequat. Nulla nisl. Nunc nisl.",2017-02-06T10:45:14Z,,"[{""tag"":""caT""}]",
23,feugiat non pretium quis,"Maecenas leo odio, condimentum id, luctus nec, molestie sed, justo. Pellentesque viverra pede ac diam. Cras pellentesque volutpat dui.

Maecenas tristique, est et tempus semper, est quam pharetra magna, ac consequat metus sapien ut nunc. Vestibulum ante ipsum primis in faucibus orci luctus et ultrices posuere cubilia Curae; Mauris viverra diam vitae quam. Suspendisse potenti.

Nullam porttitor lacus at turpis. Donec posuere metus vitae ipsum. Aliquam non mauris.

Morbi non lectus. Aliquam sit amet diam in magna bibendum imperdiet. Nullam orci pede, venenatis non, sodales sed, tincidunt eu, felis.",2016-05-18T17:06:21Z,,"[{""tag"":""BEAR""},{""tag"":""BEAR""},{""tag"":""lion""},{""tag"":""polar bear""},{""tag"":""penguin!""}]",
24,nunc viverra dapibus nulla suscipit ligula in,"Morbi porttitor lorem id ligula. Suspendisse ornare consequat lectus. In est risus, auctor sed, tristique in, tempus sit amet, sem.

Fusce consequat. Nulla nisl. Nunc nisl.

Duis bibendum, felis sed interdum venenatis, turpis enim blandit mi, in porttitor pede justo eu massa. Donec dapibus. Duis at velit eu est congue elementum.

In hac habitasse platea dictumst. Morbi vestibulum, velit id pretium iaculis, diam erat fermentum justo, nec condimentum neque sapien placerat ante. Nulla justo.

Aliquam quis turpis eget elit sodales scelerisque. Mauris sit amet eros. Suspendisse accumsan tortor quis turpis.",2019-06-19T12:03:50Z,,,"[{""category"":""blue""}]"
25,,Integer ac leo. Pellentesque ultrices mattis odio. Donec vitae nisi.,2017-11-04T03:57:59Z,2017-12-18T23:41:53Z,"[{""tag"":""ape""},{""tag"":""caT""}]","[{""category"":""grey1""},{""category"":""grey1""},{""category"":""gold""}]"
26,elementum eu,"Quisque id justo sit amet sapien dignissim vestibulum. Vestibulum ante ipsum primis in faucibus orci luctus et ultrices posuere cubilia Curae; Nulla dapibus dolor vel est. Donec odio justo, sollicitudin ut, suscipit a, feugiat et, eros.",2017-06-21T19:59:22Z,,"[{""tag"":""K1ola""},{""tag"":""eagle""},{""tag"":""ape""},{""tag"":""penguin!""},{""tag"":""caT""},{""tag"":""eagle""}]",
27,sapien a libero nam dui proin leo odio porttitor,"Maecenas tristique, est et tempus semper, est quam pharetra magna, ac consequat metus sapien ut nunc. Vestibulum ante ipsum primis in faucibus orci luctus et ultrices posuere cubilia Curae; Mauris viverra diam vitae quam. Suspendisse potenti.",2017-01-27T07:52:19Z,2019-10-11T12:53:31Z,"[{""tag"":""BEAR""},{""tag"":""ape""},{""tag"":""penguin!""},{""tag"":""polar-bear""},{""tag"":""eagle""},{""tag"":""ape""},{""tag"":""penguin!""}]","[{""category"":""orange-type-color""},{""category"":""grey1""}]"
28,vel nisl duis ac nibh fusce lacus purus aliquet at feugiat non pretium quis lectus,"Sed ante. Vivamus tortor. Duis mattis egestas metus.

Aenean fermentum. Donec ut mauris eget massa tempor convallis. Nulla neque libero, convallis eget, eleifend luctus, ultricies eu, nibh.

Quisque id justo sit amet sapien dignissim vestibulum. Vestibulum ante ipsum primis in faucibus orci luctus et ultrices posuere cubilia Curae; Nulla dapibus dolor vel est. Donec odio justo, sollicitudin ut, suscipit a, feugiat et, eros.

Vestibulum ac est lacinia nisi venenatis tristique. Fusce congue, diam id ornare imperdiet, sapien urna pretium nisl, ut volutpat sapien arcu sed augue. Aliquam erat volutpat.",2018-11-16T11:41:13Z,2018-05-06T03:19:31Z,"[{""tag"":""penguin!""},{""tag"":""panda""},{""tag"":""lion""},{""tag"":""caT""},{""tag"":""polar bear""}]","[{""category"":""gold""},{""category"":""orange-type-color""}]"
29,sed lacus morbi sem mauris laoreet ut,"Duis bibendum. Morbi non quam nec dui luctus rutrum. Nulla tellus.

In sagittis dui vel nisl. Duis ac nibh. Fusce lacus purus, aliquet at, feugiat non, pretium quis, lectus.

Suspendisse potenti. In eleifend quam a odio. In hac habitasse platea dictumst.

Maecenas ut massa quis augue luctus tincidunt. Nulla mollis molestie lorem. Quisque ut erat.

Curabitur gravida nisi at nibh. In hac habitasse platea dictumst. Aliquam augue quam, sollicitudin vitae, consectetuer eget, rutrum at, lorem.",2017-10-30T21:34:10Z,2017-10-04T21:44:10Z,"[{""tag"":""lion""},{""tag"":""polar-bear""},{""tag"":""ape""}]","[{""category"":""BLACK""},{""category"":""BLACK""},{""category"":""orange-type-color""},{""category"":""gold""},{""category"":""gold""}]"
30,,Suspendisse potenti. In eleifend quam a odio. In hac habitasse platea dictumst.,2018-07-15T02:32:14Z,2016-12-21T05:00:39Z,"[{""tag"":""ape""},{""tag"":""penguin!""}]","[{""category"":""grey1""},{""category"":""grey1""},{""category"":""grey1""},{""category"":""Brown""}]"
31,nam congue,"In sagittis dui vel nisl. Duis ac nibh. Fusce lacus purus, aliquet at, feugiat non, pretium quis, lectus.

Suspendisse potenti. In eleifend quam a odio. In hac habitasse platea dictumst.",2019-02-10T11:15:16Z,2017-11-13T23:15:25Z,"[{""tag"":""caT""},{""tag"":""ape""},{""tag"":""caT""},{""tag"":""BEAR""},{""tag"":""lion""}]","[{""category"":""purple""}]"
32,amet sem fusce consequat nulla nisl nunc nisl duis,"Mauris enim leo, rhoncus sed, vestibulum sit amet, cursus id, turpis. Integer aliquet, massa id lobortis convallis, tortor risus dapibus augue, vel accumsan tellus nisi eu orci. Mauris lacinia sapien quis libero.

Nullam sit amet turpis elementum ligula vehicula consequat. Morbi a ipsum. Integer a nibh.

In quis justo. Maecenas rhoncus aliquam lacus. Morbi quis tortor id nulla ultrices aliquet.

Maecenas leo odio, condimentum id, luctus nec, molestie sed, justo. Pellentesque viverra pede ac diam. Cras pellentesque volutpat dui.",2019-12-23T14:57:24Z,,"[{""tag"":""eagle""},{""tag"":""lion""},{""tag"":""polar bear""},{""tag"":""BEAR""},{""tag"":""polar-bear""},{""tag"":""K1ola""}]","[{""category"":""blue""}]"
33,,"Morbi porttitor lorem id ligula. Suspendisse ornare consequat lectus. In est risus, auctor sed, tristique in, tempus sit amet, sem.",2019-02-21T13:07:20Z,2016-12-29T03:55:49Z,,
34,a libero nam dui proin leo odio porttitor id consequat in consequat ut nulla,"Proin leo odio, porttitor id, consequat in, consequat ut, nulla. Sed accumsan felis. Ut at dolor quis odio consequat varius.

Integer ac leo. Pellentesque ultrices mattis odio. Donec vitae nisi.",2018-04-28T20:28:29Z,2018-07-23T03:47:24Z,"[{""tag"":""polar-bear""},{""tag"":""polar-bear""},{""tag"":""caT""},{""tag"":""panda""},{""tag"":""polar-bear""},{""tag"":""BEAR""},{""tag"":""BEAR""}]","[{""category"":""blue""}]"
35,sed magna at,"In hac habitasse platea dictumst. Morbi vestibulum, velit id pretium iaculis, diam erat fermentum justo, nec condimentum neque sapien placerat ante. Nulla justo.",2019-03-14T18:16:45Z,2016-09-23T04:01:32Z,"[{""tag"":""polar bear""},{""tag"":""caT""},{""tag"":""penguin!""},{""tag"":""eagle""},{""tag"":""polar-bear""},{""tag"":""eagle""}]","[{""category"":""grey1""},{""category"":""Brown""}]"
36,enim lorem ipsum dolor sit amet consectetuer,"Curabitur in libero ut massa volutpat convallis. Morbi odio odio, elementum eu, interdum eu, tincidunt in, leo. Maecenas pulvinar lobortis est.",2019-01-25T06:26:36Z,2016-08-09T00:49:14Z,"[{""tag"":""penguin!""},{""tag"":""ape""},{""tag"":""lion""},{""tag"":""ape""},{""tag"":""polar bear""},{""tag"":""caT""},{""tag"":""polar bear""}]","[{""category"":""Brown""},{""category"":""purple""},{""category"":""orange-type-color""}]"
37,odio condimentum id luctus nec molestie,"Maecenas leo odio, condimentum id, luctus nec, molestie sed, justo. Pellentesque viverra pede ac diam. Cras pellentesque volutpat dui.

Maecenas tristique, est et tempus semper, est quam pharetra magna, ac consequat metus sapien ut nunc. Vestibulum ante ipsum primis in faucibus orci luctus et ultrices posuere cubilia Curae; Mauris viverra diam vitae quam. Suspendisse potenti.

Nullam porttitor lacus at turpis. Donec posuere metus vitae ipsum. Aliquam non mauris.",2019-08-28T17:47:47Z,2019-06-25T02:06:01Z,,"[{""category"":""orange-type-color""}]"
38,posuere cubilia curae nulla dapibus dolor vel est donec odio justo sollicitudin ut,"Pellentesque at nulla. Suspendisse potenti. Cras in purus eu magna vulputate luctus.

Cum sociis natoque penatibus et magnis dis parturient montes, nascetur ridiculus mus. Vivamus vestibulum sagittis sapien. Cum sociis natoque penatibus et magnis dis parturient montes, nascetur ridiculus mus.

Etiam vel augue. Vestibulum rutrum rutrum neque. Aenean auctor gravida sem.

Praesent id massa id nisl venenatis lacinia. Aenean sit amet justo. Morbi ut odio.",2017-07-16T06:28:35Z,2019-02-14T08:46:20Z,"[{""tag"":""penguin!""},{""tag"":""polar bear""},{""tag"":""penguin!""},{""tag"":""ape""},{""tag"":""panda""}]",
39,tempor convallis nulla neque libero,"Fusce consequat. Nulla nisl. Nunc nisl.

Duis bibendum, felis sed interdum venenatis, turpis enim blandit mi, in porttitor pede justo eu massa. Donec dapibus. Duis at velit eu est congue elementum.

In hac habitasse platea dictumst. Morbi vestibulum, velit id pretium iaculis, diam erat fermentum justo, nec condimentum neque sapien placerat ante. Nulla justo.",2017-12-24T14:45:43Z,2019-04-26T08:52:30Z,"[{""tag"":""polar bear""},{""tag"":""penguin!""},{""tag"":""caT""},{""tag"":""polar bear""},{""tag"":""K1ola""}]","[{""category"":""gold""},{""category"":""blue""},{""category"":""blue""},{""category"":""purple""}]"
40,odio donec vitae nisi nam ultrices libero,"Proin leo odio, porttitor id, consequat in, consequat ut, nulla. Sed accumsan felis. Ut at dolor quis odio consequat varius.

Integer ac leo. Pellentesque ultrices mattis odio. Donec vitae nisi.

Nam ultrices, libero non mattis pulvinar, nulla pede ullamcorper augue, a suscipit nulla elit ac nulla. Sed vel enim sit amet nunc viverra dapibus. Nulla suscipit ligula in lacus.

Curabitur at ipsum ac tellus semper interdum. Mauris ullamcorper purus sit amet nulla. Quisque arcu libero, rutrum ac, lobortis vel, dapibus at, diam.",2017-09-22T19:35:01Z,,"[{""tag"":""penguin!""}]","[{""category"":""purple""},{""category"":""gold""},{""category"":""Brown""},{""category"":""grey1""},{""category"":""purple""}]"
41,integer,"In hac habitasse platea dictumst. Etiam faucibus cursus urna. Ut tellus.

Nulla ut erat id mauris vulputate elementum. Nullam varius. Nulla facilisi.",2019-11-14T19:03:16Z,2017-11-02T22:30:21Z,"[{""tag"":""ape""},{""tag"":""caT""},{""tag"":""lion""},{""tag"":""polar-bear""},{""tag"":""K1ola""},{""tag"":""BEAR""},{""tag"":""polar-bear""}]","[{""category"":""blue""},{""category"":""gold""},{""category"":""gold""},{""category"":""gold""}]"
42,,"Cum sociis natoque penatibus et magnis dis parturient montes, nascetur ridiculus mus. Vivamus vestibulum sagittis sapien. Cum sociis natoque penatibus et magnis dis parturient montes, nascetur ridiculus mus.",2017-01-19T02:44:28Z,,"[{""tag"":""K1ola""},{""tag"":""polar-bear""},{""tag"":""eagle""},{""tag"":""eagle""},{""tag"":""caT""},{""tag"":""ape""}]","[{""category"":""Brown""},{""category"":""BLACK""},{""category"":""BLACK""}]"
43,,"In sagittis dui vel nisl. Duis ac nibh. Fusce lacus purus, aliquet at, feugiat non, pretium quis, lectus.",2019-01-17T07:29:04Z,,"[{""tag"":""penguin!""},{""tag"":""BEAR""}]","[{""category"":""gold""},{""category"":""orange-type-color""},{""category"":""purple""}]"
44,phasellus id sapien in sapien,"Cum sociis natoque penatibus et magnis dis parturient montes, nascetur ridiculus mus. Vivamus vestibulum sagittis sapien. Cum sociis natoque penatibus et magnis dis parturient montes, nascetur ridiculus mus.

Etiam vel augue. Vestibulum rutrum rutrum neque. Aenean auctor gravida sem.

Praesent id massa id nisl venenatis lacinia. Aenean sit amet justo. Morbi ut odio.",2018-01-14T18:52:34Z,2016-06-01T13:40:47Z,"[{""tag"":""BEAR""},{""tag"":""eagle""},{""tag"":""penguin!""},{""tag"":""K1ola""},{""tag"":""lion""},{""tag"":""ape""},{""tag"":""panda""},{""tag"":""BEAR""}]","[{""category"":""blue""},{""category"":""purple""}]"
45,diam in magna bibendum imperdiet nullam orci,"Etiam vel augue. Vestibulum rutrum rutrum neque. Aenean auctor gravida sem.

Praesent id massa id nisl venenatis lacinia. Aenean sit amet justo. Morbi ut odio.

Cras mi pede, malesuada in, imperdiet et, commodo vulputate, justo. In blandit ultrices enim. Lorem ipsum dolor sit amet, consectetuer adipiscing elit.

Proin interdum mauris non ligula pellentesque ultrices. Phasellus id sapien in sapien iaculis congue. Vivamus metus arcu, adipiscing molestie, hendrerit at, vulputate vitae, nisl.

Aenean lectus. Pellentesque eget nunc. Donec quis orci eget orci vehicula condimentum.",2017-11-10T15:10:46Z,2019-06-24T12:36:39Z,"[{""tag"":""lion""},{""tag"":""polar bear""},{""tag"":""polar bear""},{""tag"":""caT""}]",
